{
  "ok": true,
  "skill_name": "episode_writer",
  "schema_version": "1.0",
  "data": {
    "project_id": "demo-episode-01",
    "episode_index": 1,
    "title": "雨夜纸鹤",
    "language": "zh-CN",
    "target_duration_seconds": 45,
    "aspect_ratio": "9:16",
    "summary": "一部悬疑、都市短篇：雨夜里，林溪在旧巷口捡到一只会发光的纸鹤。",
    "script_text": "标题：雨夜纸鹤\n时长：45 秒\nseg_01\n旁白：林溪以为这只是普通的一晚。\n对白（林溪）：你到底想带我去哪？",
    "segments": [
      {
        "segment_id": "seg_01",
        "beat_id": "beat_01_hook",
        "start_second": 0,
        "duration_seconds": 8,
        "purpose": "立刻抛出异常物件和追踪动机。",
        "visual_direction": "竖屏近景，用异常线索贴近镜头开场。",
        "narration": "林溪以为这只是普通的一晚，直到线索把林溪带向不该出现的地方。",
        "dialogue_lines": [
          {
            "speaker": "林溪",
            "line": "你到底想带我去哪？",
            "delivery": "压低声音，带一点试探。"
          }
        ],
        "pacing_note": "8 秒内完成钩子，不解释背景。",
        "sound_note": "雨夜、悬疑低频氛围。"
      },
      {
        "segment_id": "seg_02",
        "beat_id": "beat_02_setup",
        "start_second": 8,
        "duration_seconds": 12,
        "purpose": "交代地点、人物牵挂和必须行动的原因。",
        "visual_direction": "竖屏近景切到关键地点。",
        "narration": "越靠近真相，熟悉的记忆越像被人重新摆放过。",
        "dialogue_lines": [
          {
            "speaker": "林溪",
            "line": "哥哥的线索，怎么会在这里？",
            "delivery": "困惑后迅速紧张。"
          }
        ],
        "pacing_note": "12 秒保持一镜一信息点。",
        "sound_note": "雨夜、悬疑氛围延续。"
      },
      {
        "segment_id": "seg_03",
        "beat_id": "beat_03_turn",
        "start_second": 20,
        "duration_seconds": 12,
        "purpose": "让观众看到证据，并把危险推到角色面前。",
        "visual_direction": "推进到证据特写，再切林溪的反应。",
        "narration": "证据出现的那一刻，林溪终于明白，危险一直等在前方。",
        "dialogue_lines": [
          {
            "speaker": "林溪",
            "line": "原来他不是失踪，是发现了这扇门。",
            "delivery": "震惊，尾音收住。"
          }
        ],
        "pacing_note": "12 秒保持一镜一信息点。",
        "sound_note": "雨夜、悬疑氛围延续。"
      },
      {
        "segment_id": "seg_04",
        "beat_id": "beat_04_hook",
        "start_second": 32,
        "duration_seconds": 13,
        "purpose": "用未解谜团或下一步行动收束，留下继续观看理由。",
        "visual_direction": "收束在未解画面上。",
        "narration": "午夜门出现。",
        "dialogue_lines": [
          {
            "speaker": "林溪",
            "line": "如果门后是答案，我就进去。",
            "delivery": "坚定，但保留不安。"
          }
        ],
        "pacing_note": "13 秒先揭示一半真相，再用对白收尾。",
        "sound_note": "环境声骤停，结尾对白后留半秒空白。"
      }
    ],
    "subtitle_cues": [
      {
        "cue_id": "seg_01_narration",
        "start_second": 0,
        "end_second": 4,
        "text": "林溪以为这只是普通的一晚。",
        "source": "narration"
      },
      {
        "cue_id": "seg_01_dialogue",
        "start_second": 4,
        "end_second": 8,
        "text": "你到底想带我去哪？",
        "source": "dialogue"
      },
      {
        "cue_id": "seg_02_narration",
        "start_second": 8,
        "end_second": 14,
        "text": "越靠近真相，记忆越像被重排。",
        "source": "narration"
      },
      {
        "cue_id": "seg_03_dialogue",
        "start_second": 26,
        "end_second": 32,
        "text": "原来他发现了这扇门。",
        "source": "dialogue"
      }
    ],
    "voice_notes": {
      "narration": "克制、清晰、略带悬疑感；每句不拖长。",
      "dialogue": "对白短促，优先服务画面节奏。"
    },
    "review": {
      "status": "ready_for_review",
      "editable_fields": ["title", "segments", "script_text", "subtitle_cues"],
      "notes": ["用户可先改旁白和对白，再进入角色卡阶段。"]
    },
    "checkpoint": {
      "required": true,
      "policy": "pause_for_script_review",
      "reason": "episode_writer output is the first user-reviewable script artifact."
    }
  },
  "error": null,
  "runtime": {
    "duration_ms": 0,
    "model": "none",
    "mode": "deterministic-mock",
    "cost_estimate": 0
  }
}
